{
  "version": 1,
  "description": "Hôm nay mình học @Mạng chương 3",
  "mentions": [
    {
      "document_id": "11111111-1111-1111-1111-111111111111",
      "section_id": "22222222-2222-2222-2222-222222222222",
      "first_page": 40,
      "last_page": 55
    }
  ],
  "existing_units": [
    {
      "unit_id": "8f7e6d5c-4b3a-4291-8a0b-c1d2e3f4a5b6",
      "title": "Định tuyến tĩnh",
      "summary": "Bảng định tuyến được cấu hình bằng tay."
    }
  ]
}
